"GEO_ID","NAME","B19051_001E","B19051_001M","B19051_002E","B19051_002M","B19051_003E","B19051_003M",
"Geography","Geographic Area Name","Estimate!!Total","Margin of Error!!Total","Estimate!!Total!!With earnings","Margin of Error!!Total!!With earnings","Estimate!!Total!!No earnings","Margin of Error!!Total!!No earnings",
"310M300US10140","Aberdeen, WA Micro Area","29286","1312","19755","1455","9531","1080",
"310M300US10180","Abilene, TX Metro Area","61603","1937","47545","2041","14058","1308",
"310M300US10300","Adrian, MI Micro Area","38559","1367","29596","1456","8963","1045",
"310M300US10380","Aguadilla-Isabela, PR Metro Area","112215","3046","57104","3422","55111","2719",
"310M300US10420","Akron, OH Metro Area","289282","2772","221658","3980","67624","3289",
"310M300US10460","Alamogordo, NM Micro Area","23007","1488","16516","1631","6491","1059",
"310M300US10500","Albany, GA Metro Area","57607","1581","41808","1999","15799","1467",
"310M300US10540","Albany, OR Metro Area","47188","1216","35606","1575","11582","1228",
"310M300US10580","Albany-Schenectady-Troy, NY Metro Area","348421","4010","268645","4493","79776","3399",
"310M300US10700","Albertville, AL Micro Area","34083","1546","23016","1609","11067","1113",
"310M300US10740","Albuquerque, NM Metro Area","347357","3830","257835","5652","89522","4289",
"310M300US10780","Alexandria, LA Metro Area","55634","2083","39000","2323","16634","1600",
"310M300US10900","Allentown-Bethlehem-Easton, PA-NJ Metro Area","320990","3542","244677","4318","76313","3872",
"310M300US11020","Altoona, PA Metro Area","51885","1043","35905","1632","15980","1465",
"310M300US11100","Amarillo, TX Metro Area","97963","2255","79366","2598","18597","1565",
"310M300US11180","Ames, IA Metro Area","37689","1211","32640","1451","5049","826",
"310M300US11260","Anchorage, AK Metro Area","136816","1983","117159","2640","19657","1898",
"310M300US11460","Ann Arbor, MI Metro Area","140729","1922","115309","2519","25420","1767",
"310M300US11500","Anniston-Oxford-Jacksonville, AL Metro Area","44507","1715","31882","1981","12625","1419",
"310M300US11540","Appleton, WI Metro Area","94400","961","75830","1543","18570","1371",
"310M300US11640","Arecibo, PR Metro Area","68855","2565","34495","2440","34360","2344",
"310M300US11700","Asheville, NC Metro Area","190004","3229","136169","4235","53835","2656",
"310M300US11780","Ashtabula, OH Micro Area","36704","1503","26132","1450","10572","1002",
"310M300US11900","Athens, OH Micro Area","22199","1460","15481","1651","6718","1014",
"310M300US11980","Athens, TX Micro Area","32412","1498","22435","1547","9977","1115",
"310M300US12020","Athens-Clarke County, GA Metro Area","76556","2136","61166","2280","15390","1640",
"310M300US12060","Atlanta-Sandy Springs-Roswell, GA Metro Area","2102145","10010","1756081","12020","346064","8338",
"310M300US12100","Atlantic City-Hammonton, NJ Metro Area","97618","2623","72235","3140","25383","2334",
"310M300US12180","Auburn, NY Micro Area","30870","994","22885","1158","7985","825",
"310M300US12220","Auburn-Opelika, AL Metro Area","58555","1892","45429","2234","13126","1702",
"310M300US12260","Augusta-Richmond County, GA-SC Metro Area","211489","4403","154529","4725","56960","3150",
"310M300US12300","Augusta-Waterville, ME Micro Area","49616","1470","36475","1552","13141","1312",
"310M300US12420","Austin-Round Rock, TX Metro Area","755333","5920","652240","6849","103093","4321",
"310M300US12540","Bakersfield, CA Metro Area","269147","3367","212223","4618","56924","3546",
"310M300US12580","Baltimore-Columbia-Towson, MD Metro Area","1053386","6281","843403","7811","209983","5453",
"310M300US12620","Bangor, ME Metro Area","60620","1937","45360","1875","15260","1290",
"310M300US12700","Barnstable Town, MA Metro Area","92148","3008","63985","2930","28163","1884",
"310M300US12940","Baton Rouge, LA Metro Area","299655","4947","235090","6142","64565","3773",
"310M300US12980","Battle Creek, MI Metro Area","54556","1354","39136","1732","15420","1376",
"310M300US13020","Bay City, MI Metro Area","44907","1067","29904","1710","15003","1490",
"310M300US13140","Beaumont-Port Arthur, TX Metro Area","149713","3663","111351","3343","38362","2595",
"310M300US13180","Beaver Dam, WI Micro Area","34228","942","26841","1077","7387","698",
"310M300US13220","Beckley, WV Metro Area","48342","1517","30199","2041","18143","1717",
"310M300US13380","Bellingham, WA Metro Area","88636","1559","68036","2082","20600","1555",
"310M300US13460","Bend-Redmond, OR Metro Area","74498","2649","57045","3148","17453","1885",
"310M300US13740","Billings, MT Metro Area","70979","1579","56177","1934","14802","1418",
"310M300US13780","Binghamton, NY Metro Area","99370","2148","69347","2598","30023","1843",
"310M300US13820","Birmingham-Hoover, AL Metro Area","439543","4862","328303","5327","111240","4042",
"310M300US13900","Bismarck, ND Metro Area","55632","1092","45528","1321","10104","1052",
"310M300US13980","Blacksburg-Christiansburg-Radford, VA Metro Area","66947","2498","50435","2367","16512","1634",
"310M300US14010","Bloomington, IL Metro Area","71476","1871","55394","2592","16082","1521",
"310M300US14020","Bloomington, IN Metro Area","64763","1719","51571","2410","13192","1719",
"310M300US14100","Bloomsburg-Berwick, PA Metro Area","33823","1163","25278","1207","8545","883",
"310M300US14140","Bluefield, WV-VA Micro Area","40842","1776","24285","1874","16557","1462",
"310M300US14260","Boise City, ID Metro Area","257970","2860","202740","3702","55230","2962",
"310M300US14460","Boston-Cambridge-Newton, MA-NH Metro Area","1823034","7528","1480023","8506","343011","7585",
"310M300US14500","Boulder, CO Metro Area","128497","1759","107355","2549","21142","1722",
"310M300US14540","Bowling Green, KY Metro Area","65444","2134","50979","2056","14465","1599",
"310M300US14580","Bozeman, MT Micro Area","44315","963","38090","1293","6225","1062",
"310M300US14660","Brainerd, MN Micro Area","38088","1459","26560","1327","11528","834",
"310M300US14700","Branson, MO Micro Area","32848","2311","23074","1972","9774","1194",
"310M300US14740","Bremerton-Silverdale, WA Metro Area","104902","1850","79212","2322","25690","2044",
"310M300US14860","Bridgeport-Stamford-Norwalk, CT Metro Area","336433","3586","274540","4189","61893","2866",
"310M300US15180","Brownsville-Harlingen, TX Metro Area","123024","2446","93618","3058","29406","2423",
"310M300US15260","Brunswick, GA Metro Area","45891","2618","30964","2382","14927","2112",
"310M300US15380","Buffalo-Cheektowaga-Niagara Falls, NY Metro Area","475055","4375","349560","4921","125495","4317",
"310M300US15500","Burlington, NC Metro Area","64371","1425","49047","1749","15324","1580",
"310M300US15540","Burlington-South Burlington, VT Metro Area","87914","1538","71985","1978","15929","1354",
"310M300US15680","California-Lexington Park, MD Metro Area","40820","1443","33924","1510","6896","1031",
"310M300US15940","Canton-Massillon, OH Metro Area","165473","2261","123183","2896","42290","2198",
"310M300US15980","Cape Coral-Fort Myers, FL Metro Area","266266","6274","170818","5749","95448","4610",
"310M300US16020","Cape Girardeau, MO-IL Metro Area","37032","1491","27368","1719","9664","1228",
"310M300US16060","Carbondale-Marion, IL Metro Area","50153","1670","36141","1924","14012","1178",
"310M300US16180","Carson City, NV Metro Area","22773","562","16874","928","5899","876",
"310M300US16220","Casper, WY Metro Area","32556","1241","26651","1465","5905","773",
"310M300US16300","Cedar Rapids, IA Metro Area","107802","2042","88430","2264","19372","1652",
"310M300US16500","Centralia, WA Micro Area","31786","995","22808","1284","8978","1009",
"310M300US16540","Chambersburg-Waynesboro, PA Metro Area","60979","1311","45205","1667","15774","1471",
"310M300US16580","Champaign-Urbana, IL Metro Area","95429","2138","73849","2493","21580","2101",
"310M300US16620","Charleston, WV Metro Area","87463","2774","58463","2619","29000","2088",
"310M300US16700","Charleston-North Charleston, SC Metro Area","290586","3775","232052","4826","58534","3059",
"310M300US16740","Charlotte-Concord-Gastonia, NC-SC Metro Area","944261","5666","767409","6649","176852","4757",
"310M300US16820","Charlottesville, VA Metro Area","88632","2497","69494","2659","19138","1742",
"310M300US16860","Chattanooga, TN-GA Metro Area","220186","2986","159650","3925","60536","3101",
"310M300US16940","Cheyenne, WY Metro Area","39054","1455","30209","1929","8845","1556",
"310M300US16980","Chicago-Naperville-Elgin, IL-IN-WI Metro Area","3488312","11436","2800656","14998","687656","10739",
"310M300US17020","Chico, CA Metro Area","88797","2187","61728","2953","27069","1950",
"310M300US17060","Chillicothe, OH Micro Area","27914","1433","20194","1458","7720","997",
"310M300US17140","Cincinnati, OH-KY-IN Metro Area","852639","4787","675609","6575","177030","4510",
"310M300US17200","Claremont-Lebanon, NH-VT Micro Area","86458","2765","66181","3008","20277","1777",
"310M300US17220","Clarksburg, WV Micro Area","35736","1237","25537","1543","10199","1228",
"310M300US17300","Clarksville, TN-KY Metro Area","105056","2643","84783","2835","20273","1791",
"310M300US17340","Clearlake, CA Micro Area","27399","1363","18340","1532","9059","1264",
"310M300US17420","Cleveland, TN Metro Area","47923","1095","36512","1568","11411","1393",
"310M300US17460","Cleveland-Elyria, OH Metro Area","862586","5146","638594","6336","223992","4492",
"310M300US17660","Coeur d'Alene, ID Metro Area","60383","1911","44555","2306","15828","1552",
"310M300US17780","College Station-Bryan, TX Metro Area","91999","2597","74723","3166","17276","2176",
"310M300US17820","Colorado Springs, CO Metro Area","268122","2621","217548","3369","50574","2660",
"310M300US17860","Columbia, MO Metro Area","70355","1728","57414","2398","12941","1571",
"310M300US17900","Columbia, SC Metro Area","309760","4276","242288","4900","67472","3070",
"310M300US17980","Columbus, GA-AL Metro Area","112937","2704","82704","3551","30233","2273",
"310M300US18020","Columbus, IN Metro Area","31498","1173","24369","1443","7129","970",
"310M300US18140","Columbus, OH Metro Area","788946","4874","642733","6142","146213","5402",
"310M300US18180","Concord, NH Micro Area","58220","1355","46561","1663","11659","1474",
"310M300US18260","Cookeville, TN Micro Area","44284","1619","29611","1931","14673","1562",
"310M300US18300","Coos Bay, OR Micro Area","26578","1294","15704","1425","10874","1387",
"310M300US18500","Corning, NY Micro Area","38382","1623","27526","1473","10856","948",
"310M300US18580","Corpus Christi, TX Metro Area","160796","2852","124852","3279","35944","2775",
"310M300US18700","Corvallis, OR Metro Area","35445","1109","27852","1608","7593","1090",
"310M300US18880","Crestview-Fort Walton Beach-Destin, FL Metro Area","108474","3271","83583","3509","24891","2068",
"310M300US18980","Cullman, AL Micro Area","30740","1568","22001","1534","8739","968",
"310M300US19060","Cumberland, MD-WV Metro Area","37611","1726","25094","1562","12517","1086",
"310M300US19100","Dallas-Fort Worth-Arlington, TX Metro Area","2573711","9897","2198981","11346","374730","7810",
"310M300US19140","Dalton, GA Metro Area","48645","1696","37311","1927","11334","1257",
"310M300US19180","Danville, IL Metro Area","30241","1213","20285","1434","9956","973",
"310M300US19260","Danville, VA Micro Area","44440","1709","30145","1844","14295","1373",
"310M300US19300","Daphne-Fairhope-Foley, AL Metro Area","79120","2586","55023","3011","24097","1789",
"310M300US19340","Davenport-Moline-Rock Island, IA-IL Metro Area","151284","2494","112777","3128","38507","2066",
"310M300US19380","Dayton, OH Metro Area","329442","3759","245768","4325","83674","3318",
"310M300US19460","Decatur, AL Metro Area","56691","2036","39270","2376","17421","1929",
"310M300US19500","Decatur, IL Metro Area","42977","1505","30885","1666","12092","1139",
"310M300US19660","Deltona-Daytona Beach-Ormond Beach, FL Metro Area","260002","3990","165984","4203","94018","3362",
"310M300US19740","Denver-Aurora-Lakewood, CO Metro Area","1105758","5347","936594","6623","169164","4805",
"310M300US19780","Des Moines-West Des Moines, IA Metro Area","250612","2642","209823","2677","40789","2055",
"310M300US19820","Detroit-Warren-Dearborn, MI Metro Area","1707501","8035","1286093","9563","421408","6524",
"310M300US20020","Dothan, AL Metro Area","55442","1449","39382","1569","16060","878",
"310M300US20100","Dover, DE Metro Area","63807","1705","49236","2118","14571","1708",
"310M300US20180","DuBois, PA Micro Area","29098","1272","20065","1477","9033","884",
"310M300US20220","Dubuque, IA Metro Area","37785","966","29336","1304","8449","954",
"310M300US20260","Duluth, MN-WI Metro Area","117874","1954","84674","2182","33200","1553",
"310M300US20380","Dunn, NC Micro Area","46661","1021","36118","1343","10543","1175",
"310M300US20500","Durham-Chapel Hill, NC Metro Area","224437","2604","182418","3427","42019","2762",
"310M300US20700","East Stroudsburg, PA Metro Area","57668","2454","44575","2660","13093","1557",
"310M300US20740","Eau Claire, WI Metro Area","67079","1242","52929","1747","14150","1337",
"310M300US20940","El Centro, CA Metro Area","44478","1682","33931","1916","10547","1684",
"310M300US21020","Elizabeth City, NC Micro Area","24290","1694","17014","1421","7276","1105",
"310M300US21060","Elizabethtown-Fort Knox, KY Metro Area","57979","1618","45489","2096","12490","1405",
"310M300US21140","Elkhart-Goshen, IN Metro Area","73363","1396","60400","1876","12963","1249",
"310M300US21300","Elmira, NY Metro Area","32247","1594","23078","1842","9169","1044",
"310M300US21340","El Paso, TX Metro Area","270076","2813","219916","3488","50160","2745",
"310M300US21420","Enid, OK Metro Area","22784","1177","17369","1336","5415","917",
"310M300US21500","Erie, PA Metro Area","108458","1975","79332","2383","29126","1848",
"310M300US21660","Eugene, OR Metro Area","151675","2015","111624","2684","40051","2392",
"310M300US21700","Eureka-Arcata-Fortuna, CA Micro Area","53446","1854","39889","2078","13557","1669",
"310M300US21780","Evansville, IN-KY Metro Area","130667","2029","98584","2862","32083","1937",
"310M300US21820","Fairbanks, AK Metro Area","35046","1911","31608","1760","3438","1007",
"310M300US22020","Fargo, ND-MN Metro Area","100721","1883","87106","2238","13615","1310",
"310M300US22060","Faribault-Northfield, MN Micro Area","23130","844","18389","1030","4741","648",
"310M300US22100","Farmington, MO Micro Area","22504","1609","15677","1632","6827","1105",
"310M300US22140","Farmington, NM Metro Area","41071","1584","30845","1730","10226","956",
"310M300US22180","Fayetteville, NC Metro Area","143306","2079","111977","2547","31329","1718",
"310M300US22220","Fayetteville-Springdale-Rogers, AR-MO Metro Area","194671","3150","158874","3456","35797","2096",
"310M300US22300","Findlay, OH Micro Area","31844","1080","24180","1202","7664","1065",
"310M300US22380","Flagstaff, AZ Metro Area","47977","2031","38142","2192","9835","1221",
"310M300US22420","Flint, MI Metro Area","165719","2865","115902","3254","49817","2359",
"310M300US22500","Florence, SC Metro Area","79458","1828","58439","2414","21019","1751",
"310M300US22520","Florence-Muscle Shoals, AL Metro Area","60041","1748","41831","2127","18210","1726",
"310M300US22540","Fond du Lac, WI Metro Area","42449","902","33507","1139","8942","874",
"310M300US22580","Forest City, NC Micro Area","26408","1666","16636","1609","9772","1245",
"310M300US22660","Fort Collins, CO Metro Area","134709","2471","106288","2862","28421","1765",
"310M300US22840","Fort Payne, AL Micro Area","25848","1206","17434","1554","8414","1218",
"310M300US22900","Fort Smith, AR-OK Metro Area","108133","2228","76941","2841","31192","2218",
"310M300US23060","Fort Wayne, IN Metro Area","168359","2253","132868","2799","35491","2080",
"310M300US23180","Frankfort, KY Micro Area","30237","1237","22909","1402","7328","972",
"310M300US23420","Fresno, CA Metro Area","305819","2635","243201","3706","62618","3123",
"310M300US23460","Gadsden, AL Metro Area","37091","1718","22921","1929","14170","1377",
"310M300US23540","Gainesville, FL Metro Area","104101","2638","78345","2906","25756","2072",
"310M300US23580","Gainesville, GA Metro Area","62164","1853","50090","2012","12074","1098",
"310M300US23700","Gallup, NM Micro Area","21083","640","14975","840","6108","745",
"310M300US23900","Gettysburg, PA Metro Area","39527","1005","29744","1241","9783","800",
"310M300US24020","Glens Falls, NY Metro Area","50135","1882","36752","1898","13383","973",
"310M300US24060","Glenwood Springs, CO Micro Area","27568","1852","24049","1891","3519","752",
"310M300US24140","Goldsboro, NC Metro Area","47720","1488","35654","2160","12066","1576",
"310M300US24220","Grand Forks, ND-MN Metro Area","42613","974","33933","1410","8680","1058",
"310M300US24260","Grand Island, NE Metro Area","32578","1121","26897","1340","5681","715",
"310M300US24300","Grand Junction, CO Metro Area","61763","1535","45508","1913","16255","1546",
"310M300US24340","Grand Rapids-Wyoming, MI Metro Area","394268","3385","317399","4363","76869","2930",
"310M300US24420","Grants Pass, OR Metro Area","36493","959","21961","1505","14532","1561",
"310M300US24500","Great Falls, MT Metro Area","33346","1326","25137","1575","8209","984",
"310M300US24540","Greeley, CO Metro Area","104611","1323","87321","2065","17290","1485",
"310M300US24580","Green Bay, WI Metro Area","129383","1616","102655","2016","26728","1690",
"310M300US24620","Greeneville, TN Micro Area","27249","1469","18376","1703","8873","1180",
"310M300US24640","Greenfield Town, MA Micro Area","29239","952","21755","1116","7484","917",
"310M300US24660","Greensboro-High Point, NC Metro Area","297140","3293","228511","4186","68629","3178",
"310M300US24780","Greenville, NC Metro Area","68505","2253","54191","2650","14314","1814",
"310M300US24860","Greenville-Anderson-Mauldin, SC Metro Area","343167","3226","263462","4244","79705","3446",
"310M300US24940","Greenwood, SC Micro Area","35800","1816","25574","1536","10226","1273",
"310M300US25020","Guayama, PR Metro Area","25610","2116","10960","1805","14650","1931",
"310M300US25060","Gulfport-Biloxi-Pascagoula, MS Metro Area","150780","3773","111515","4291","39265","2816",
"310M300US25180","Hagerstown-Martinsburg, MD-WV Metro Area","98959","1966","74512","2363","24447","1894",
"310M300US25220","Hammond, LA Metro Area","49272","1581","36730","2264","12542","1779",
"310M300US25260","Hanford-Corcoran, CA Metro Area","43029","1015","35893","1387","7136","1076",
"310M300US25420","Harrisburg-Carlisle, PA Metro Area","226354","2925","177616","3386","48738","2410",
"310M300US25500","Harrisonburg, VA Metro Area","47777","1445","37713","1726","10064","1213",
"310M300US25540","Hartford-West Hartford-East Hartford, CT Metro Area","470731","4182","367254","4524","103477","3603",
"310M300US25620","Hattiesburg, MS Metro Area","54181","1765","41253","2485","12928","1950",
"310M300US25740","Helena, MT Micro Area","32950","1194","25357","1335","7593","976",
"310M300US25840","Hermiston-Pendleton, OR Micro Area","30864","1024","24417","1358","6447","1019",
"310M300US25860","Hickory-Lenoir-Morganton, NC Metro Area","141250","2821","102662","3271","38588","2171",
"310M300US25900","Hilo, HI Micro Area","68857","2122","50414","2631","18443","1980",
"310M300US25940","Hilton Head Island-Bluffton-Beaufort, SC Metro Area","79217","2727","52971","2631","26246","1797",
"310M300US25980","Hinesville, GA Metro Area","29826","1732","25237","1882","4589","1118",
"310M300US26020","Hobbs, NM Micro Area","22222","1083","17490","1274","4732","879",
"310M300US26090","Holland, MI Micro Area","44766","1071","34965","1259","9801","922",
"310M300US26140","Homosassa Springs, FL Metro Area","61290","2602","31982","2500","29308","2053",
"310M300US26300","Hot Springs, AR Metro Area","38594","1792","26277","2126","12317","1524",
"310M300US26380","Houma-Thibodaux, LA Metro Area","77302","1657","56750","2468","20552","1838",
"310M300US26420","Houston-The Woodlands-Sugar Land, TX Metro Area","2324758","11003","1980832","10709","343926","8362",
"310M300US26580","Huntington-Ashland, WV-KY-OH Metro Area","139983","2897","89204","3195","50779","2512",
"310M300US26620","Huntsville, AL Metro Area","180708","2736","141493","3385","39215","2257",
"310M300US26660","Huntsville, TX Micro Area","27477","1627","19451","1767","8026","1383",
"310M300US26740","Hutchinson, KS Micro Area","24910","1000","19197","1060","5713","758",
"310M300US26820","Idaho Falls, ID Metro Area","50941","789","40861","1195","10080","1104",
"310M300US26860","Indiana, PA Micro Area","33664","1197","23950","1251","9714","844",
"310M300US26900","Indianapolis-Carmel-Anderson, IN Metro Area","773361","5469","619529","5305","153832","4753",
"310M300US26980","Iowa City, IA Metro Area","67822","1646","56691","1795","11131","1198",
"310M300US27060","Ithaca, NY Metro Area","40230","1323","32675","1586","7555","1088",
"310M300US27100","Jackson, MI Metro Area","62220","1324","45995","1572","16225","1325",
"310M300US27140","Jackson, MS Metro Area","211178","3816","163514","3918","47664","2972",
"310M300US27180","Jackson, TN Metro Area","47865","1557","33892","1575","13973","1515",
"310M300US27260","Jacksonville, FL Metro Area","560169","5175","435733","6804","124436","4781",
"310M300US27340","Jacksonville, NC Metro Area","62941","2875","51495","2633","11446","1555",
"310M300US27460","Jamestown-Dunkirk-Fredonia, NY Micro Area","51985","2010","35810","2023","16175","1158",
"310M300US27500","Janesville-Beloit, WI Metro Area","64878","1145","49028","1647","15850","1299",
"310M300US27600","Jefferson, GA Micro Area","23785","852","18596","1120","5189","970",
"310M300US27620","Jefferson City, MO Metro Area","54732","1667","42755","1692","11977","1347",
"310M300US27740","Johnson City, TN Metro Area","83579","2777","58141","2967","25438","2135",
"310M300US27780","Johnstown, PA Metro Area","56023","1680","37746","1726","18277","1228",
"310M300US27860","Jonesboro, AR Metro Area","51087","1361","40300","2111","10787","1529",
"310M300US27900","Joplin, MO Metro Area","69136","1590","53045","1935","16091","1413",
"310M300US27980","Kahului-Wailuku-Lahaina, HI Metro Area","53616","1859","43139","1988","10477","1357",
"310M300US28020","Kalamazoo-Portage, MI Metro Area","133112","2442","103770","2860","29342","1704",
"310M300US28060","Kalispell, MT Micro Area","37236","1723","27690","1721","9546","1096",
"310M300US28100","Kankakee, IL Metro Area","39628","1191","29383","1377","10245","966",
"310M300US28140","Kansas City, MO-KS Metro Area","829475","5275","669999","6799","159476","4348",
"310M300US28180","Kapaa, HI Micro Area","22980","1082","17999","1112","4981","703",
"310M300US28300","Keene, NH Micro Area","29385","1307","22836","1241","6549","698",
"310M300US28420","Kennewick-Richland, WA Metro Area","98742","1625","77313","2317","21429","2012",
"310M300US28580","Key West, FL Micro Area","31285","1883","23227","1802","8058","958",
"310M300US28660","Killeen-Temple, TX Metro Area","149197","3097","120060","3213","29137","2145",
"310M300US28700","Kingsport-Bristol-Bristol, TN-VA Metro Area","129285","2772","86665","3104","42620","2283",
"310M300US28740","Kingston, NY Metro Area","68822","2184","53215","2023","15607","1531",
"310M300US28900","Klamath Falls, OR Micro Area","27616","1302","18508","1429","9108","1034",
"310M300US28940","Knoxville, TN Metro Area","347479","4167","260665","5039","86814","3025",
"310M300US29020","Kokomo, IN Metro Area","34243","1399","25185","1642","9058","1084",
"310M300US29100","La Crosse-Onalaska, WI-MN Metro Area","55940","878","44179","1662","11761","1215",
"310M300US29180","Lafayette, LA Metro Area","179072","3729","134137","4817","44935","3012",
"310M300US29200","Lafayette-West Lafayette, IN Metro Area","80855","1894","67069","2224","13786","1430",
"310M300US29300","LaGrange, GA Micro Area","24716","1176","17594","1455","7122","1028",
"310M300US29340","Lake Charles, LA Metro Area","81266","2406","62327","3019","18939","1892",
"310M300US29380","Lake City, FL Micro Area","24335","1258","16871","1407","7464","990",
"310M300US29420","Lake Havasu City-Kingman, AZ Metro Area","87565","2751","49377","2694","38188","1903",
"310M300US29460","Lakeland-Winter Haven, FL Metro Area","233058","4313","162991","4274","70067","3111",
"310M300US29540","Lancaster, PA Metro Area","201150","1871","160732","2950","40418","2419",
"310M300US29620","Lansing-East Lansing, MI Metro Area","186203","1991","142739","2284","43464","2211",
"310M300US29700","Laredo, TX Metro Area","74045","1601","61904","2002","12141","1502",
"310M300US29740","Las Cruces, NM Metro Area","75441","2513","52155","3104","23286","1999",
"310M300US29820","Las Vegas-Henderson-Paradise, NV Metro Area","781796","5934","619056","7015","162740","4751",
"310M300US29860","Laurel, MS Micro Area","30755","2069","22436","1957","8319","1402",
"310M300US29940","Lawrence, KS Metro Area","47643","1418","39598","1777","8045","1096",
"310M300US30020","Lawton, OK Metro Area","46009","1523","36404","1888","9605","1049",
"310M300US30140","Lebanon, PA Metro Area","52786","1327","39634","1645","13152","1220",
"310M300US30300","Lewiston, ID-WA Metro Area","25553","1155","18088","1263","7465","1003",
"310M300US30340","Lewiston-Auburn, ME Metro Area","45979","1233","34106","1637","11873","1267",
"310M300US30460","Lexington-Fayette, KY Metro Area","202610","2839","164484","3714","38126","2259",
"310M300US30620","Lima, OH Metro Area","40872","993","31148","1275","9724","1081",
"310M300US30700","Lincoln, NE Metro Area","129363","1808","108061","2224","21302","1406",
"310M300US30780","Little Rock-North Little Rock-Conway, AR Metro Area","283142","3968","219900","4310","63242","3197",
"310M300US30860","Logan, UT-ID Metro Area","42764","901","36640","1228","6124","847",
"310M300US30940","London, KY Micro Area","46409","1842","26799","1967","19610","1671",
"310M300US30980","Longview, TX Metro Area","76055","2422","59391","2597","16664","1773",
